[{"_id":"aefaaaaaaabf2a33abbckalhycg6lhaaaaaq","OriginatingAgency":"RATP","TotalObjects":{"ingested":8,"deleted":0,"remained":8},"TotalObjectGroups":{"ingested":6,"deleted":0,"remained":6},"TotalUnits":{"ingested":16,"deleted":0,"remained":16},"ObjectSize":{"ingested":36,"deleted":0,"remained":36},"CreationDate":"2018-12-18T09:03:0492","_v":2,"_tenant":0}]
