[{"_id":"aefaaaaaaabf2a33abbckalhycg6lhaaaaaq","OriginatingAgency":"RATP","TotalObjects":{"ingested":11.0,"deleted":0.0,"remained":11.0},"TotalObjectGroups":{"ingested":6.0,"deleted":0.0,"remained":6.0},"TotalUnits":{"ingested":16.0,"deleted":0.0,"remained":16.0},"ObjectSize":{"ingested":54.0,"deleted":0.0,"remained":54.0},"CreationDate":"2018-12-18T09:03:04.092","_v":3,"_tenant":0}]
