[
  {
    "OriginatingAgency": "RATP",
    "TotalObjects": {
      "ingested": 5,
      "deleted": 0,
      "remained": 5
    },
    "TotalObjectGroups": {
      "ingested": 3,
      "deleted": 0,
      "remained": 3
    },
    "TotalUnits": {
      "ingested": 9,
      "deleted": 0,
      "remained": 9
    },
    "ObjectSize": {
      "ingested": 9986,
      "deleted": 0,
      "remained": 9986
    },
    "_v": 2,
    "_tenant": 0
  }
]
