[{"_id":"aefaaaaaaabf2a33abbckalhycg7mnyaaaaq","OriginatingAgency":"FRAN_NP_009913","TotalObjects":{"ingested":8,"deleted":0,"remained":8},"TotalObjectGroups":{"ingested":8,"deleted":0,"remained":8},"TotalUnits":{"ingested":14,"deleted":0,"remained":14},"ObjectSize":{"ingested":313294,"deleted":0,"remained":313294},"CreationDate":"2018-12-18T09:03:08.343","_v":2,"_tenant":0}]